{
  "id": "p7b-preview-diff",
  "version": 1,
  "title": "변경 전후 무엇이 바뀌는지 미리 확인",
  "summary": "변경 전후 무엇이 바뀌는지 미리 확인 작업을 재사용 가능한 프롬프트로 수행하도록 입력과 출력 조건을 정리한다.",
  "kind": "plain",
  "difficulty": "intermediate",
  "template": "[바꾸려는 요청 내용]. 실제로 코드를 바꾸기 전에, 어떤 파일의 어떤 부분이 바뀌고 그로 인해 다른 기능이 깨질 위험이 있는지 먼저 설명해줘. 내가 확인하면 그때 진행.",
  "variables": [
    {
      "name": "input_1",
      "description": "바꾸려는 요청 내용",
      "required": true,
      "example": "바꾸려는 요청 내용"
    }
  ],
  "outputContract": {
    "format": "code",
    "description": "요청한 조건과 형식을 지키며 확인 가능한 결과만 반환한다.",
    "schema": null,
    "sections": []
  },
  "notes": "중요한 사실·날짜·수치는 연결된 1차 출처에서 다시 확인하고, 확인되지 않은 내용은 사용하지 않는다.",
  "examples": [],
  "tags": [
    "코딩",
    "검증",
    "안전"
  ],
  "courseIds": [
    "responsible-ai"
  ],
  "relatedWikiSlugs": [
    "checkpoint"
  ],
  "providerScope": "provider-agnostic",
  "provenance": {
    "origin": "migrated-reference",
    "authorship": "migration-reviewed",
    "legacyKey": "public:p7b-preview-diff"
  },
  "status": "reviewed",
  "reviewedAt": "2026-07-16"
}
