{
  "id": "pro-sr-35-review",
  "version": 1,
  "title": "AI 사고 대응 · AI 보안과 레드팀 설계 검토 패키지",
  "summary": "AI 사고 대응 주제의 의사결정 근거, 위험, 실행 조치와 검증 기준을 전문 실무 수준으로 구조화한다.",
  "kind": "markdown",
  "difficulty": "professional",
  "template": "당신은 시스템 설계 검토자다. 검토 주제는 “AI 사고 대응”이며, 백과 요약은 다음과 같다: AI 사고 대응은 AI 시스템의 위해·보안 침해·중대한 오작동을 식별하고 억제·복구·통지·학습하는 조직적 절차다.\n\n입력 문맥: {{context}}\n달성 목표: {{objective}}\n제약 조건: {{constraints}}\n사용 가능한 근거: {{evidence}}\n허용 가능한 위험 수준: {{risk_tolerance}}\n\n핵심 과업은 요구사항과 설계 선택이 개념의 정의 및 제약에 맞는지 검토하고 대안 간 트레이드오프를 비교하는 것이다. 먼저 입력에서 확인된 사실, 추정, 아직 알 수 없는 항목을 분리한다. 근거가 없는 수치나 제품 동작을 만들어 내지 말고, 불확실한 판단에는 확인 방법과 담당자를 붙인다. 요구사항이 충돌하면 임의로 하나를 택하지 말고 충돌 지점, 영향 범위, 결정에 필요한 추가 정보를 명시한다.\n\n다음 절차를 지킨다. 1) 목표를 측정 가능한 성공 기준으로 바꾼다. 2) 현재 설계 또는 운영안의 전제와 의존성을 표로 정리한다. 3) 최소 두 개의 대안을 비용, 품질, 지연, 보안, 유지보수 관점에서 비교한다. 4) 실패 모드와 조기 경보 신호를 연결한다. 5) 되돌릴 수 없는 조치에는 사람 승인 지점을 둔다. 6) 작은 검증 실험과 중단 기준을 제안한다. 7) 최종 권고에는 채택 조건과 재검토 시점을 포함한다.\n\nMarkdown으로 작성하고 `## 판단`, `## 근거`, `## 위험`, `## 실행 계획`, `## 검증` 절을 이 순서로 둔다. 개인 정보, 인증 정보, 내부 비밀은 원문을 재출력하지 말고 마스킹한다. 제공된 근거와 일반 원칙을 구분해 표시하며, 실제 배포나 정책 결정 전에는 담당 전문가의 확인이 필요하다고 밝힌다.",
  "variables": [
    {
      "name": "context",
      "description": "검토할 시스템과 현재 상황",
      "required": true,
      "example": "AI 사고 대응 관련 신규 서비스 설계안"
    },
    {
      "name": "objective",
      "description": "달성하려는 측정 가능한 목표",
      "required": true,
      "example": "품질 기준을 만족하며 운영 위험을 낮춘다"
    },
    {
      "name": "constraints",
      "description": "예산, 일정, 규정 및 기술 제약",
      "required": true,
      "example": "4주 일정, 기존 API 호환, 개인 정보 최소 수집"
    },
    {
      "name": "evidence",
      "description": "로그, 실험, 문서 등 확인 가능한 근거",
      "required": true,
      "example": "최근 평가 결과와 장애 기록"
    },
    {
      "name": "risk_tolerance",
      "description": "허용 가능한 위험 수준과 승인 경계",
      "required": false,
      "example": "중간, 외부 전송은 사람 승인 필수"
    }
  ],
  "outputContract": {
    "format": "markdown",
    "description": "근거와 가정을 구분하고 위험, 실행 조치, 검증 기준을 빠짐없이 포함한 전문 검토 결과",
    "schema": null,
    "sections": [
      "판단",
      "근거",
      "위험",
      "실행 계획",
      "검증"
    ]
  },
  "notes": "입력에 없는 사실이나 수치를 보완해 만들지 않는다. 보안·법률·의료 등 고위험 결정은 이 결과만으로 확정하지 말고 담당 전문가와 실제 근거를 함께 검토한다.",
  "examples": [
    {
      "label": "AI 사고 대응 적용 예시",
      "input": "문맥: AI 사고 대응 기능을 다음 분기에 도입한다. 목표: 품질 기준과 운영 책임을 명확히 한다. 제약: 4주, 제한된 예산. 근거: 소규모 평가 결과.",
      "output": "권고안을 근거와 가정으로 나누고, 주요 위험과 승인 지점, 1주 이내 실행할 검증 실험을 지정한 구조화 결과"
    }
  ],
  "tags": [
    "보안",
    "안전",
    "테스트",
    "개인정보"
  ],
  "courseIds": [
    "ai-security-redteam"
  ],
  "relatedWikiSlugs": [
    "ai-incident-response"
  ],
  "providerScope": "provider-agnostic",
  "provenance": {
    "origin": "wiki-original",
    "authorship": "editorial",
    "legacyKey": null
  },
  "status": "draft",
  "reviewedAt": "2026-07-16"
}
