{
  "id": "p31i-decisions",
  "version": 1,
  "title": "3 회의록/대화에서 결정사항만",
  "summary": "3 회의록/대화에서 결정사항만 작업을 재사용 가능한 프롬프트로 수행하도록 입력과 출력 조건을 정리한다.",
  "kind": "plain",
  "difficulty": "entry",
  "template": "아래는 회의(또는 단체 대화) 내용이야. 여기서 '결정된 사항'과 '누가 무엇을 언제까지 하기로 했는지'만 표 형태(담당자 / 할 일 / 기한)로 정리해줘. 잡담과 미정 사항은 빼줘. [여기에 회의록/대화 붙여넣기]",
  "variables": [
    {
      "name": "input_1",
      "description": "여기에 회의록/대화 붙여넣기",
      "required": true,
      "example": "여기에 회의록/대화 붙여넣기"
    }
  ],
  "outputContract": {
    "format": "text",
    "description": "요청한 조건과 형식을 지키며 확인 가능한 결과만 반환한다.",
    "schema": null,
    "sections": []
  },
  "notes": "입력 자리표시자를 실제 상황에 맞게 바꾸고, 결과의 사실성·톤·누락 여부를 사람이 최종 확인한다.",
  "examples": [],
  "tags": [
    "글쓰기",
    "요약",
    "생산성",
    "안전",
    "협업"
  ],
  "courseIds": [
    "responsible-ai"
  ],
  "relatedWikiSlugs": [
    "hallucination"
  ],
  "providerScope": "provider-agnostic",
  "provenance": {
    "origin": "migrated-reference",
    "authorship": "migration-reviewed",
    "legacyKey": "public:p31i-decisions"
  },
  "status": "reviewed",
  "reviewedAt": "2026-07-16"
}
