{
  "id": "freelance-profile-optimization-p3",
  "version": 1,
  "title": "3단계 패키지 구성 설계",
  "summary": "3단계 패키지 구성 설계 작업을 재사용 가능한 프롬프트로 수행하도록 입력과 출력 조건을 정리한다.",
  "kind": "plain",
  "difficulty": "entry",
  "template": "내 서비스 [서비스 설명]의 BASIC/STANDARD/DELUXE 3단계 패키지를 설계해줘. 가운데(STANDARD)가 가장 합리적으로 보이도록 가격과 포함 항목을 배치해줘. 각 패키지마다 가격, 작업 범위, 수정 횟수, 작업 기간, 포함/미포함 항목을 표로 정리하고, 구매자가 STANDARD를 고르게 만드는 심리 포인트도 한 줄로 설명해줘.",
  "variables": [
    {
      "name": "input_1",
      "description": "서비스 설명",
      "required": true,
      "example": "서비스 설명"
    }
  ],
  "outputContract": {
    "format": "table",
    "description": "요청한 조건과 형식을 지키며 확인 가능한 결과만 반환한다.",
    "schema": null,
    "sections": []
  },
  "notes": "입력 자리표시자를 실제 상황에 맞게 바꾸고, 결과의 사실성·톤·누락 여부를 사람이 최종 확인한다.",
  "examples": [],
  "tags": [
    "검색",
    "고객 지원",
    "비즈니스"
  ],
  "courseIds": [
    "rag-search"
  ],
  "relatedWikiSlugs": [
    "semantic-search"
  ],
  "providerScope": "provider-agnostic",
  "provenance": {
    "origin": "migrated-reference",
    "authorship": "migration-reviewed",
    "legacyKey": "public:freelance-profile-optimization-p3"
  },
  "status": "reviewed",
  "reviewedAt": "2026-07-16"
}
