{
  "id": "p27w-title",
  "version": 1,
  "title": "슬라이드 제목 문장으로 다듬기",
  "summary": "슬라이드 제목 문장으로 다듬기 작업을 재사용 가능한 프롬프트로 수행하도록 입력과 출력 조건을 정리한다.",
  "kind": "plain",
  "difficulty": "entry",
  "template": "아래 명사형 슬라이드 제목들을 '한 슬라이드 한 메시지' 원칙에 맞게 주장하는 완결 문장으로 바꿔 줘. 짧고 구체적으로. [예: '시장 현황', '경쟁사 분석', '제안' 나열]",
  "variables": [
    {
      "name": "input_1",
      "description": "예: '시장 현황', '경쟁사 분석', '제안' 나열",
      "required": true,
      "example": "'시장 현황', '경쟁사 분석', '제안' 나열"
    }
  ],
  "outputContract": {
    "format": "text",
    "description": "요청한 조건과 형식을 지키며 확인 가능한 결과만 반환한다.",
    "schema": null,
    "sections": []
  },
  "notes": "중요한 사실·날짜·수치는 연결된 1차 출처에서 다시 확인하고, 확인되지 않은 내용은 사용하지 않는다.",
  "examples": [],
  "tags": [
    "글쓰기",
    "프레젠테이션",
    "데이터 분석",
    "출처·인용",
    "비즈니스"
  ],
  "courseIds": [
    "multimodal-ai"
  ],
  "relatedWikiSlugs": [
    "prompt"
  ],
  "providerScope": "provider-agnostic",
  "provenance": {
    "origin": "migrated-reference",
    "authorship": "migration-reviewed",
    "legacyKey": "public:p27w-title"
  },
  "status": "reviewed",
  "reviewedAt": "2026-07-16"
}
