{
  "id": "p8b-table",
  "version": 1,
  "title": "4대 언어 한 장 요약표 생성",
  "summary": "4대 언어 한 장 요약표 생성 작업을 재사용 가능한 프롬프트로 수행하도록 입력과 출력 조건을 정리한다.",
  "kind": "plain",
  "difficulty": "intermediate",
  "template": "Python, JavaScript, HTML/CSS, SQL을 '언어 | 한 줄 용도 | 대표 예시 | 난이도' 4칸짜리 표로. 한국어로.",
  "variables": [],
  "outputContract": {
    "format": "table",
    "description": "요청한 조건과 형식을 지키며 확인 가능한 결과만 반환한다.",
    "schema": null,
    "sections": []
  },
  "notes": "비밀 키와 운영 데이터를 제거한 예제로 먼저 시험하고, 생성된 코드는 테스트와 보안 검토를 거친다.",
  "examples": [],
  "tags": [
    "요약",
    "번역",
    "의사결정",
    "코딩",
    "프롬프트 설계",
    "웹 개발"
  ],
  "courseIds": [
    "api-development"
  ],
  "relatedWikiSlugs": [
    "api"
  ],
  "providerScope": "provider-agnostic",
  "provenance": {
    "origin": "migrated-reference",
    "authorship": "migration-reviewed",
    "legacyKey": "public:p8b-table"
  },
  "status": "reviewed",
  "reviewedAt": "2026-07-16"
}
