{
  "id": "n8n-automation-p4",
  "version": 1,
  "title": "n8n에서 막혔을 때 ChatGPT/Claude에 물어볼 프롬프트",
  "summary": "n8n에서 막혔을 때 ChatGPT/Claude에 물어볼 프롬프트 작업을 재사용 가능한 프롬프트로 수행하도록 입력과 출력 조건을 정리한다.",
  "kind": "plain",
  "difficulty": "entry",
  "template": "나는 n8n으로 자동화를 만들고 있어. [노드 이름] 노드에서 이런 빨간 에러가 떠: [에러 메시지 붙여넣기]. 초등학생도 알게 한국어로 원인 1줄과 해결 단계를 번호로 알려줘.",
  "variables": [
    {
      "name": "input_1",
      "description": "노드 이름",
      "required": true,
      "example": "노드 이름"
    },
    {
      "name": "input_2",
      "description": "에러 메시지 붙여넣기",
      "required": true,
      "example": "에러 메시지 붙여넣기"
    }
  ],
  "outputContract": {
    "format": "text",
    "description": "요청한 조건과 형식을 지키며 확인 가능한 결과만 반환한다.",
    "schema": null,
    "sections": []
  },
  "notes": "전송·저장·삭제 같은 부작용이 없는 시험 환경에서 먼저 실행하고, 되돌릴 수 없는 작업은 사람의 승인을 받는다.",
  "examples": [],
  "tags": [
    "번역",
    "교육",
    "스프레드시트",
    "디버깅",
    "자동화",
    "프롬프트 설계"
  ],
  "courseIds": [
    "agent-systems"
  ],
  "relatedWikiSlugs": [
    "workflow-orchestration"
  ],
  "providerScope": "multi-provider",
  "provenance": {
    "origin": "migrated-reference",
    "authorship": "migration-reviewed",
    "legacyKey": "public:n8n-automation-p4"
  },
  "status": "reviewed",
  "reviewedAt": "2026-07-16"
}
