{
  "id": "p44i-report",
  "version": 1,
  "title": "자료 요약 보고서용 (대안 과제)",
  "summary": "자료 요약 보고서용 (대안 과제) 작업을 재사용 가능한 프롬프트로 수행하도록 입력과 출력 조건을 정리한다.",
  "kind": "plain",
  "difficulty": "entry",
  "template": "아래 붙여넣은 자료를 [1페이지 요약 보고서]로 정리해줘. 구성: 1)핵심 요약 3줄 2)주요 내용 불릿 5개 3)결론/제안 2줄. 규칙: 자료에 없는 수치·주장은 넣지 말고, 불확실하면 '자료에 없음'이라 표기해줘. [여기에 자료 붙여넣기]",
  "variables": [
    {
      "name": "input_1",
      "description": "1페이지 요약 보고서",
      "required": true,
      "example": "1페이지 요약 보고서"
    },
    {
      "name": "input_2",
      "description": "여기에 자료 붙여넣기",
      "required": true,
      "example": "여기에 자료 붙여넣기"
    }
  ],
  "outputContract": {
    "format": "text",
    "description": "요청한 조건과 형식을 지키며 확인 가능한 결과만 반환한다.",
    "schema": null,
    "sections": []
  },
  "notes": "전송·저장·삭제 같은 부작용이 없는 시험 환경에서 먼저 실행하고, 되돌릴 수 없는 작업은 승인을 받는다.",
  "examples": [
    {
      "label": "작성 예시",
      "input": "아래 붙여넣은 자료를 실제 값로 정리해줘. 구성: 1)핵심 요약 3줄 2)주요 내용 불릿 5개 3)결론/제안 2줄. 규칙: 자료에 없는 수치·주장은 넣지 말고, 불확실하면 '자료에 없음'이라 표기해줘. 실제 값",
      "output": ""
    }
  ],
  "tags": [
    "글쓰기",
    "요약",
    "문서 분석",
    "자동화",
    "프롬프트 설계",
    "이미지"
  ],
  "courseIds": [
    "multimodal-ai"
  ],
  "relatedWikiSlugs": [
    "image-generation"
  ],
  "providerScope": "provider-agnostic",
  "provenance": {
    "origin": "migrated-reference",
    "authorship": "migration-reviewed",
    "legacyKey": "public:p44i-report"
  },
  "status": "reviewed",
  "reviewedAt": "2026-07-16"
}
