{
  "id": "p7b-rollback",
  "version": 1,
  "title": "망가졌을 때 되돌리기",
  "summary": "망가졌을 때 되돌리기 작업을 재사용 가능한 프롬프트로 수행하도록 입력과 출력 조건을 정리한다.",
  "kind": "plain",
  "difficulty": "intermediate",
  "template": "방금 한 변경([무엇을 바꿨는지]) 때문에 [어떤 문제]가 생겼어. 그 변경을 완전히 취소하고 직전의 정상 상태로 되돌려줘. 새 기능이나 코드는 추가하지 말고 원상복구만.",
  "variables": [
    {
      "name": "input_1",
      "description": "무엇을 바꿨는지",
      "required": true,
      "example": "무엇을 바꿨는지"
    },
    {
      "name": "input_2",
      "description": "어떤 문제",
      "required": true,
      "example": "어떤 문제"
    }
  ],
  "outputContract": {
    "format": "code",
    "description": "요청한 조건과 형식을 지키며 확인 가능한 결과만 반환한다.",
    "schema": null,
    "sections": []
  },
  "notes": "중요한 사실·날짜·수치는 연결된 1차 출처에서 다시 확인하고, 확인되지 않은 내용은 사용하지 않는다.",
  "examples": [],
  "tags": [
    "코딩",
    "검증",
    "안전"
  ],
  "courseIds": [
    "responsible-ai"
  ],
  "relatedWikiSlugs": [
    "checkpoint"
  ],
  "providerScope": "provider-agnostic",
  "provenance": {
    "origin": "migrated-reference",
    "authorship": "migration-reviewed",
    "legacyKey": "public:p7b-rollback"
  },
  "status": "reviewed",
  "reviewedAt": "2026-07-16"
}
